Date,Name,Year,Letterboxd URI,Rating,Rewatch,Review,Tags,Watched Date
2024-10-22,Habit,1995,https://boxd.it/7BRDRN,4.5,Yes,"It was so good to re-watch this on the big screen at Nighthawk, for the Brooklyn Horror Festival! It has all these amazing details that I missed, watching it before. The way this film moves, the tension, the genre balance, all exceptional. But it would be easy to forget subtle but great shooting choices as well: the moment at the party where the camera pushes in on his face when he's attracted to the woman across the room. The sickining angles on the ferris wheel. The moment out in the rain. The movie is fun and interesting, and it's so engaging it's easy to miss when it's also a gorgeous record of a particular era of NYC as well.",,2024-10-20
2024-10-22,Drácula,1931,https://boxd.it/7CeFQN,4,,Renfield is amazing in this!,,2024-10-21
2024-10-23,Stream,2024,https://boxd.it/7CEaeb,2.5,,"I dunno man, maybe hire out for a writer next time.",,2024-10-22
2024-10-27,The Cabinet of Dr. Caligari,1920,https://boxd.it/7Eiuht,5,,So great to see this with a live score!,,2024-10-25
2024-11-15,Bedazzled,2000,https://boxd.it/7OnuFP,4,,"This was really sweet actually, especially for a film involving the devil.",,2024-11-14
2024-11-16,Apartment 7A,2024,https://boxd.it/7OSP9n,3,,"Very pretty, some good performances, needed a rewrite on the plot side.",,2024-11-16
2024-12-09,Things Heard & Seen,2021,https://boxd.it/80EkMD,2,Yes,"Accidentally watched this movie a second time and didn't realize until the mess kicked in. It is a film that asks you not to pay full attention to it and punishes you when you do. All the more frustrating because the first act and the last scene prove this could have been a lot better, which damns the film even worse.",,2024-12-09
2024-12-16,Heretic,2024,https://boxd.it/84c4yZ,3,,"It's hard to watch this and not think

1. There's a chunk missing 
2. They're setting up a prequel",,2024-12-16
2025-01-12,Bring on the Damned!,2025,https://boxd.it/8r9aIx,4,,A ton of fun and extremely creative!,,2025-01-11
2025-01-20,Chained,2012,https://boxd.it/8xXuu5,3.5,,"It was alright, but I feel like the ending could have and should have gone a different way. Also a few strange choices throughout that I'm not really into. ",,2025-01-19
2025-02-05,Wolf Man,2025,https://boxd.it/8JORJn,2.5,,"I don't know what went wrong exactly to make this so boring, but it's some combination of bad editing, bad coloring and acting that's just too 'realistic' to keep my attention.",,2025-02-05
2025-02-05,The Dark Half,1993,https://boxd.it/8JOSYN,3.5,,Someone call this film and let it know Malignant basically took its inciting incident wholesale.,,2025-02-02
2025-02-15,Satan's Little Helper,2004,https://boxd.it/8Q6047,2,,What?,,2025-02-15
2025-03-17,Bulworth,1998,https://boxd.it/99rQFR,4,,Wild that basically we are touching on the exact same issues in 2025.,,2025-03-16
2025-04-21,The Last Winter,2006,https://boxd.it/9ts2jX,4,Yes,The bleak visuals here are so well served on a big screen. Highly recommend catching this on as large a screen as possible.,,2025-04-20
2025-05-30,Star Wars,1977,https://boxd.it/9Qz0xz,5,,The new trilogy: Andor->Rogue One->New Hope,,2025-05-29
2025-06-03,Cat's Eye,1985,https://boxd.it/9TcWDr,3.5,,Surprisingly good performance from the cat(s)!,,2025-06-02
2025-07-10,The Old Guard 2,2025,https://boxd.it/ahgWtv,2.5,,We're making movies that straight up don't finish now?,,2025-07-09
2025-07-14,Superman,2025,https://boxd.it/akgkm9,4.5,,Everything I wanted in a Superman film,,2025-07-13
